<?xml version="1.0" encoding="UTF-8"?>
<Linp-Mapping xmlns="http://www.lindbergframework.org/schema" 
		xmlns:xsi="http://www.w3.org/2001/XMLSchema-instance" 
		xsi:schemaLocation="http://www.lindbergframework.org/schema linp-sqlMapping.xsd">
		
<Description>Exemplo de Updates</Description>
    
    <Sql-Mapping>
       <Sql-Command id="inserirPessoa">
          <Sql-Statement>insert into pessoa values(?,?,?,?,?,?)</Sql-Statement>
       </Sql-Command>
       
       <Sql-Command id="excluirPessoa">
          <Sql-Statement>delete from pessoa where cpf = ?</Sql-Statement>
       </Sql-Command>
       
       <Sql-Command id="atualizarEnderecoPessoa">
          <Sql-Statement>update pessoa set bairro = ?, rua = ?, numero = ?, numeroCep = ? where cpf = ?</Sql-Statement>
       </Sql-Command>
       
       <Sql-Command id="excluirPessoaUsandoProcedure">
          <Procedure name="excluirPessoa"/>
       </Sql-Command>
       
       <Sql-Command id="excPessoasPorIniciaisRetornandoExcluidosENaoExcluidosUsandoFunction">
          <Function name="excPessoasRetornaExcluidosFunc" resultName="pessoasexcluidas">
             <OutCursor population-class="org.lindbergframework.exemplo.beans.Pessoa"/><!-- Não Excluidos São como resultado da função através de um cursor  -->
             <ResultCursor population-class="org.lindbergframework.exemplo.beans.Pessoa" /><!-- Excluidos -->
          </Function>
       </Sql-Command>
       
       <Sql-Command id="excPessoasPorIniciaisRetornandoExcluidosENaoExcluidosUsandoProcedure">
          <Procedure name="excPessoasRetornaExcluidosProc">
             <OutCursor population-class="org.lindbergframework.exemplo.beans.Pessoa"/><!-- Não Excluidos -->
             <OutCursor population-class="org.lindbergframework.exemplo.beans.Pessoa"/><!-- Excluidos -->
          </Procedure>
       </Sql-Command>
    </Sql-Mapping>
    		
</Linp-Mapping>
