<?xml version="1.0" encoding="UTF-8"?>
<Linp-Mapping xmlns="http://www.lindbergframework.org/schema" xmlns:xsi="http://www.w3.org/2001/XMLSchema-instance" xsi:schemaLocation="http://www.lindbergframework.org/schema ../org/lindbergframework/schemas/linp-sqlMapping.xsd ">

    <Description>Queries</Description>
    
    <Sql-Mapping>
       <Sql-Command id="queryPersons">
          <Sql-Statement>select p.*,street addres.street, addres_num addres.number from person p</Sql-Statement>
       </Sql-Command>
       
       <Sql-Command id="queryPersonsLikeNickname">
          <Sql-Statement>select p.*,street addres.street, addres_num addres.number from person p where nickname like ?</Sql-Statement>
       </Sql-Command>
       
       <Sql-Command id="queryPersonsFromId">
          <Sql-Statement>select p.*,street addres.street, addres_num addres.number from person p where id = ?</Sql-Statement>
       </Sql-Command>
       
       <Sql-Command id="queryPersonsFromBirth_date">
          <Sql-Statement>select p.*,street addres.street, addres_num addres.number from person p where birth_date = ?</Sql-Statement>
       </Sql-Command>
       
       <Sql-Command id="queryEmployees">
          <Sql-Statement>select p.*,street addres.street, addres_num addres.number, 1000 wage from person p</Sql-Statement>
       </Sql-Command>
       
       <Sql-Command id="findPersonNickFromProcedure">
          <Procedure name="findPerson" />
       </Sql-Command>
                
       <Sql-Command id="out3NickPersons">
          <Procedure name="out3NickPersons" />
       </Sql-Command>
                
       <Sql-Command id="findPersonNickFunc">
          <Function name="findPersonNickFunc" />
       </Sql-Command>
       
    </Sql-Mapping>          

</Linp-Mapping>
